textid,Words,anger,disgust,fear,joy,sad,surprise
1,senator carl krueger thinks ipods can kill you,0.061841,0.04783,0.139895,0.309802,0.252972,0.18766
2,who is prince frederic von anhalt,0.061471,0.04759,0.139522,0.310721,0.252562,0.188134
3,prestige has magic touch,0.061851,0.047381,0.14021,0.310692,0.252263,0.187604
4,study female seals picky about mates,0.062331,0.048095,0.14135,0.308427,0.252415,0.187382
5,no e book for harry potter vii,0.061505,0.047041,0.140571,0.307706,0.253638,0.189539
6,blair apologises over friendly fire inquest,0.061409,0.047333,0.140332,0.312505,0.251353,0.187068
7,vegetables may boost brain power in older adults,nan,nan,nan,nan,nan,nan
8,afghan forces retake town that was overrun by taliban,0.061984,0.047672,0.140793,0.308466,0.253374,0.187712
9,skip the showers male sweat turns women on study says,0.0618,0.047719,0.140743,0.307317,0.253903,0.188517
10,made in china irks some burberry shoppers,0.061946,0.047899,0.140614,0.306158,0.254373,0.189008
11,britain to restrict immigrants from new eu members,0.061775,0.047853,0.1399,0.306811,0.254813,0.188848
12,canadian breakthrough offers hope on autism,0.06188,0.047471,0.140672,0.308748,0.253994,0.187235
13,russia to strengthen its military muscle,0.061904,0.047283,0.141215,0.305956,0.255148,0.188495
14,alzheimer s drugs offer no help study finds,0.061717,0.047614,0.140809,0.308987,0.252984,0.18789
15,uk police slammed over terror raid,0.061529,0.047231,0.140158,0.311835,0.251067,0.18818
16,no rejects police state claim,0.06149,0.04723,0.139177,0.31249,0.251842,0.187772
17,oprah announces new book club pick,0.062015,0.047574,0.140978,0.309373,0.252752,0.187308
18,smith can t be buried until hearing,0.061956,0.047912,0.140141,0.309588,0.252497,0.187906
19,african nation hopes whoopi can help,0.061959,0.047906,0.14013,0.310027,0.252188,0.187791
20,tourism lags in bush s hometown,0.061184,0.047277,0.139314,0.311638,0.252316,0.188272
21,air france klm profit rises,0.061962,0.047898,0.140115,0.310575,0.251802,0.187648
22,au regrets sudan s expulsion of un envoy,0.061943,0.047626,0.140951,0.307559,0.25326,0.188659
23,taiwan s mr clean indicted steps down,0.061653,0.047545,0.140766,0.31139,0.250948,0.187697
24,martian life could have evaded detection by viking landers,nan,nan,nan,nan,nan,nan
25,turner pays for boston bombing,0.061557,0.046939,0.140547,0.307973,0.253663,0.189322
26,serena misses bangalore tournament,0.061503,0.047544,0.139917,0.311766,0.251623,0.187648
27,attorneys point fingers in fight between ryan o neal and son,0.06203,0.04799,0.140705,0.305591,0.25506,0.188625
28,pledge i was abused in frat hazing,0.061946,0.047899,0.140614,0.306158,0.254373,0.189008
29,whistle blowing web site exposed,0.061184,0.047277,0.139314,0.311638,0.252316,0.188272
30,growing unarmed battalion in qaeda army is using internet to get the message out,0.061619,0.047672,0.139934,0.307772,0.254141,0.188861
31,royal rescues presidential hopes with commanding performance,0.061833,0.047817,0.139863,0.310213,0.25274,0.187534
32,minister slams airlines on carbon,0.061735,0.047664,0.14082,0.310735,0.251901,0.187145
33,audio slide show a love story lasting years,0.061981,0.047474,0.140444,0.307645,0.253984,0.188471
34,fully cooked chicken strips recalled,0.061417,0.047544,0.139435,0.311355,0.252219,0.18803
35,madonna adoption bid approved,0.061212,0.046891,0.138761,0.316491,0.249657,0.186988
36,rowdy fans ejected from the open,0.061536,0.04686,0.140066,0.308045,0.254257,0.189237
37,snow wreaks havoc in east midwest,0.061612,0.04763,0.139893,0.308987,0.252861,0.189016
38,the energy challenge exotic visions how to cool a planet maybe,0.061728,0.047756,0.140021,0.307669,0.253819,0.189008
39,libby defense upsets judge rests,0.061716,0.047403,0.139689,0.310431,0.252768,0.187992
40,briton admits u s bomb plot role,0.061171,0.046847,0.139787,0.311311,0.252393,0.188491
41,routine mission turns into hunt for missing comrade,0.061648,0.047203,0.140449,0.307317,0.254159,0.189224
42,ex suspect slams anti terror laws,0.061698,0.047556,0.140993,0.312467,0.250758,0.186528
43,federer overcomes a ragged start,0.061791,0.047123,0.140019,0.310412,0.252588,0.188067
44,investigation of child porn site hits nations,0.059131,0.045357,0.134856,0.333477,0.241563,0.185615
45,bangladesh ends curfew amid unrest,0.061184,0.047277,0.139314,0.311638,0.252316,0.188272
46,sarkozy comfort zone offers a royal opportunity,0.061833,0.047817,0.139863,0.310213,0.25274,0.187534
47,sick hearts switch on a fetal gene,0.061499,0.047256,0.140149,0.308328,0.253838,0.188931
48,chinese president arrives in mozambique african tour nearly over,0.061825,0.047821,0.14028,0.306859,0.254075,0.18914
49,homemade bombs kill on indian train,0.061721,0.047387,0.140508,0.308398,0.253155,0.188831
50,france rejects rwandan investigators,0.061503,0.047544,0.139917,0.311766,0.251623,0.187648
51,at libby trial russert of nbc gives and gets,0.061602,0.047328,0.14051,0.308594,0.253287,0.188678
52,rare optimism as north korea talks reach crossroads,0.06161,0.047005,0.140079,0.310951,0.251378,0.188978
53,for women nothing s like the smell of men s sweat,nan,nan,nan,nan,nan,nan
54,reports harvard set to name first female president,0.061942,0.047904,0.140573,0.30611,0.254466,0.189005
55,justin timberlake cameron diaz announce split,0.061734,0.047466,0.139744,0.309914,0.253043,0.188099
56,hastert sorry for scandal but not quitting,0.061671,0.047686,0.139989,0.308657,0.253242,0.188755
57,world s oldest newspaper now exists only online,0.061673,0.047347,0.140565,0.309458,0.252171,0.188786
58,houston she s got some problems,0.062035,0.047867,0.14068,0.309795,0.252033,0.18759
59,firms on alert for letter bombs,0.061797,0.047774,0.140315,0.30729,0.253623,0.1892
60,study africa s internet gap getting wider,0.06196,0.047782,0.141467,0.308909,0.252198,0.187683
61,siesta cuts risk of heart disease death study finds,0.061923,0.047574,0.141061,0.307049,0.25338,0.189014
62,spain ahead although nadal is out,0.061595,0.047636,0.139991,0.310404,0.252438,0.187935
63,runway making good without making nice,0.061471,0.04759,0.139522,0.310721,0.252562,0.188134
64,russia plans new icbms nuclear subs,0.061764,0.047411,0.140691,0.309701,0.252023,0.18841
65,no buyer in sight for napster,0.061519,0.047536,0.140077,0.308248,0.253699,0.188921
66,outcry at n korea nuclear test,0.06181,0.047222,0.140061,0.309819,0.252915,0.188174
67,ipod good for video games,0.061851,0.047381,0.14021,0.310692,0.252263,0.187604
68,taking the plunge,0.061883,0.047221,0.140875,0.31024,0.253361,0.18642
69,england include giles in wc squad,0.062107,0.048013,0.141019,0.305548,0.254896,0.188416
70,beyonce copyright claim rejected,0.061081,0.047182,0.139183,0.312495,0.251886,0.188172
71,london market a shopping dining haven,0.061823,0.047801,0.139823,0.310716,0.252457,0.18738
72,pm havana deal a good experiment,0.061755,0.047697,0.140761,0.310172,0.252275,0.18734
73,dozens killed in baghdad bombing,0.061741,0.047717,0.140237,0.308284,0.253218,0.188803
74,damaged japanese whaling ship may resume hunting off antarctica,0.061882,0.047593,0.14056,0.307991,0.254319,0.187656
75,un nuclear watchdog slashes iran aid,0.061663,0.047365,0.139774,0.311354,0.252129,0.187715
76,toyota s scion parks in second life,0.061263,0.047351,0.139414,0.310973,0.252649,0.18835
77,telecoms giant slashes jobs,0.061346,0.047486,0.139321,0.312171,0.251778,0.187898
78,canete wins inaugural joburg open,0.061881,0.047467,0.139514,0.312472,0.25173,0.186937
79,yahoo s mission quest,0.062074,0.047842,0.140841,0.310917,0.251097,0.187229
80,weekly nielsen will lost find its way back,0.062161,0.047818,0.140324,0.308589,0.253134,0.187973
81,u s online love brokers eye china,0.061095,0.046788,0.139252,0.312869,0.251983,0.188013
82,amish schoolhouse torn down,0.061422,0.047112,0.138999,0.313576,0.251302,0.187589
83,china cheney shores up the trilateral alliance,0.062069,0.04761,0.141557,0.306716,0.253565,0.188482
84,g yen skates by yuan singled out,0.061515,0.047626,0.139591,0.310215,0.252837,0.188216
85,friendly fire pilot experienced,nan,nan,nan,nan,nan,nan
86,updates on world s top stories,nan,nan,nan,nan,nan,nan
87,diplomat acknowledges us arrogance in iraq,0.061637,0.047253,0.139913,0.309009,0.25349,0.188697
88,madonna s new baby s daddy didn t realize adoption was for good,0.061606,0.047613,0.140223,0.308961,0.253154,0.188443
89,appeal by chinese researcher for times may soon be heard,0.061727,0.04775,0.140036,0.30793,0.253749,0.188808
90,snowbirds shortening their florida stays,0.061417,0.047544,0.139435,0.311355,0.252219,0.18803
91,oxfam action needed for chad,0.061238,0.046696,0.140264,0.310198,0.252465,0.189139
92,bush adamant on troops to iraq,0.062107,0.048013,0.141019,0.305548,0.254896,0.188416
93,ukraine gas deal marred by fears,0.061595,0.047636,0.139991,0.310404,0.252438,0.187935
94,shoplifters choice police or t shirt of shame,0.061749,0.047477,0.140509,0.309942,0.252465,0.187858
95,travel chaos as heavy snow hits uk,0.061673,0.04756,0.140811,0.309861,0.252638,0.187457
96,tow truck drivers accused of stealing cars,0.061956,0.047912,0.140141,0.309588,0.252497,0.187906
97,joseph wambaugh s new start,0.061611,0.047147,0.140752,0.309955,0.251074,0.189461
98,human error caused helios crash,0.061184,0.047277,0.139314,0.311638,0.252316,0.188272
99,charts is your city lean or lethargic,0.062187,0.047802,0.140336,0.308876,0.252923,0.187876
100,st louis poised for entertainment upswing,0.061594,0.047046,0.140507,0.307703,0.253869,0.189282
101,ivrea journal in italian town a civics lesson from pelting neighbors,0.06203,0.04799,0.140705,0.305591,0.25506,0.188625
102,review virtual american idol hits right notes,0.057067,0.044051,0.129391,0.354979,0.2322,0.182312
103,squadron apologies over friendly fire death,0.061409,0.047333,0.140332,0.312505,0.251353,0.187068
104,the breast cancer breakthrough saving women a year,0.061415,0.047093,0.140262,0.308866,0.253128,0.189235
105,abbas rejects temporary state,0.061346,0.047486,0.139321,0.312171,0.251778,0.187898
106,iraqi forces detain official suspected in shia conspiracy,0.061817,0.047808,0.14029,0.306975,0.253954,0.189156
107,congressman rebukes u s allies for lack of support in afghanistan,0.061795,0.04763,0.140262,0.307873,0.253869,0.188571
108,easy ways to really save,0.061399,0.04709,0.140125,0.309006,0.253465,0.188914
109,real suffer carlos injury setback,0.061184,0.047277,0.139314,0.311638,0.252316,0.188272
110,marijuana may stave off alzheimer s,0.061775,0.047334,0.140993,0.308589,0.252088,0.18922
111,smokestacks in a white wilderness divide iceland,0.062085,0.048007,0.140929,0.30556,0.254943,0.188476
112,paris journal smoking no longer tres chic in france,0.062052,0.047997,0.140797,0.305578,0.255011,0.188564
113,cher s dress car bed have new owners,0.061799,0.047444,0.140852,0.308048,0.252686,0.189172
114,hungarian opposition calls for vote after violence escalates,0.061693,0.047712,0.140008,0.308368,0.253443,0.188776
115,freed kidnap suspect my terror at police raid,0.061822,0.047375,0.141238,0.309493,0.251594,0.188479
116,rockers big winners at brit awards,0.061689,0.047324,0.140237,0.31049,0.253208,0.187052
117,cia leak trial summary,0.061695,0.047321,0.139617,0.311093,0.252419,0.187854
118,experts issue new heart disease guidelines for women,0.061693,0.047712,0.140008,0.308368,0.253443,0.188776
119,in god s name religion based tax breaks housing to paychecks to books,0.061942,0.047564,0.140503,0.306761,0.254352,0.188878
120,snow causes transport chaos in britain,0.061,0.046787,0.138081,0.316383,0.249676,0.188073
121,injured sarwan to miss one dayers,0.061148,0.046878,0.139708,0.308165,0.255077,0.189025
122,study napping might help heart,0.061853,0.047455,0.140211,0.310079,0.25263,0.187771
123,tailors and housewives busy as muslims celebrate eid,0.061953,0.047917,0.140149,0.30923,0.252751,0.188
124,malaysia aggressively wooing tourists,0.061695,0.047321,0.139617,0.311093,0.252419,0.187854
125,creating a whole album in a month,0.061844,0.047711,0.141098,0.30811,0.253503,0.187733
126,wellcome awards anti fat research,0.061417,0.047544,0.139435,0.311355,0.252219,0.18803
127,can t do this anymore not jack,0.062064,0.047708,0.140059,0.309501,0.253164,0.187505
128,iran s boast on uranium enrichment is put to test,0.061984,0.047672,0.140793,0.308466,0.253374,0.187712
129,iraq closes borders with syria and iran,0.062192,0.047448,0.141196,0.30783,0.253443,0.187892
130,in clue to addiction brain injury halts smoking,0.062067,0.048001,0.140857,0.30557,0.25498,0.188524
131,manning inspires giants to victory in dallas,0.061783,0.047773,0.140244,0.307649,0.253703,0.188847
132,research supports medicinal marijuana,0.061346,0.047486,0.139321,0.312171,0.251778,0.187898
133,iraq insurgents attack us base,0.061962,0.047898,0.140115,0.310575,0.251802,0.187648
134,fire extinguisher part of tennessee execution kit,0.06188,0.04752,0.140628,0.308447,0.254123,0.187402
135,city sets up ice storm shelters,0.061957,0.047473,0.141408,0.307722,0.252829,0.188611
136,gently weeps lyrics sheet up for sale,0.061505,0.047041,0.140571,0.307706,0.253638,0.189539
137,cholesterol link in diabetes study,0.062136,0.048022,0.141133,0.305533,0.254836,0.18834
138,zoo polar bear to have root canal,0.061608,0.047057,0.140068,0.308412,0.25376,0.189096
139,howard slams obama on iraq policy,0.061957,0.047473,0.141408,0.307722,0.252829,0.188611
140,fight starts over hpv vaccine,0.062158,0.04788,0.142201,0.308915,0.25216,0.186685
141,obama announces presidential bid,0.061973,0.047763,0.140611,0.31251,0.24966,0.187482
142,another death at georgia aquarium,0.061881,0.047467,0.139514,0.312472,0.25173,0.186937
143,johnny depp to make movie of spy poisoning,0.060606,0.046229,0.137831,0.31676,0.250506,0.188068
144,pap test a mainstay against cervical cancer may be fading,0.06178,0.047557,0.140426,0.307541,0.253819,0.188878
145,boy allegedly told to kill by mom gives up,0.061786,0.047862,0.139925,0.306708,0.254859,0.188859
146,catania punished for fan violence,0.061557,0.046939,0.140547,0.307973,0.253663,0.189322
147,the summit a slap in the face of the palestinians,0.061568,0.047308,0.140564,0.30952,0.252777,0.188263
148,dead bachelors in remote china still find wives,0.061684,0.047395,0.13997,0.308345,0.25385,0.188757
149,boy missing since found alive,0.061853,0.047455,0.140211,0.310079,0.25263,0.187771
150,girl left comatose after dental visit dies,0.062002,0.047614,0.140905,0.309012,0.252999,0.187469
151,fine wines in british columbia,0.062136,0.048022,0.141133,0.305533,0.254836,0.18834
152,bollywood s brangelina engaged,0.062074,0.047842,0.140841,0.310917,0.251097,0.187229
153,north korea ready to discuss nuke disarmament,0.06129,0.047273,0.139844,0.311793,0.251435,0.188365
154,action intensity boosts vision,0.061695,0.047321,0.139617,0.311093,0.252419,0.187854
155,stonehenge workers village found,0.061081,0.047182,0.139183,0.312495,0.251886,0.188172
156,scientists tout cocoa s health benefits,0.061968,0.047763,0.141609,0.309257,0.251854,0.18755
157,can north korea be trusted,0.061391,0.046978,0.140251,0.311959,0.250179,0.189242
158,trailblazing trio protects city by the bay,0.06199,0.047426,0.140467,0.307841,0.253855,0.188421
159,ganguly handed india squad call up,0.061595,0.047636,0.139991,0.310404,0.252438,0.187935
160,beauticians cut curl offer stroke prevention info,0.061515,0.047626,0.139591,0.310215,0.252837,0.188216
161,studios sign off on movie downloads,0.061743,0.04749,0.140277,0.308871,0.253226,0.188395
162,global web of suspects in child rape download,0.061817,0.047808,0.14029,0.306975,0.253954,0.189156
163,libby prosecutors await judge s rulings,0.061809,0.047641,0.141247,0.310347,0.25121,0.187746
164,police probe church fires half mile apart,0.061515,0.047626,0.139591,0.310215,0.252837,0.188216
165,second hanging also went awry iraq tape shows,0.061953,0.047917,0.140149,0.30923,0.252751,0.188
166,stepping back in time at ski resort,0.061783,0.047773,0.140244,0.307649,0.253703,0.188847
167,iraqi journalists add laws to list of dangers,0.0617,0.047064,0.14032,0.306731,0.25503,0.189155
168,boy scouts blamed for starting wildfire,0.061797,0.047774,0.140315,0.30729,0.253623,0.1892
169,report links humans to global warming,0.061454,0.047182,0.140139,0.308629,0.253673,0.188924
170,stenson defends his title at dubai,0.06189,0.04753,0.139608,0.31166,0.252148,0.187163
171,iraqi linked to sunni bloc is held in plot military says,0.061662,0.047691,0.140117,0.307281,0.254309,0.18894
172,china launches two satellites into orbit,0.061969,0.047827,0.141215,0.308799,0.252665,0.187525
173,north africa feared as staging ground for terror,0.061515,0.047266,0.139587,0.309886,0.253155,0.18859
174,breast cancer drug promises hope,0.061417,0.047544,0.139435,0.311355,0.252219,0.18803
175,mortar assault leaves at least dead,0.06181,0.047222,0.140061,0.309819,0.252915,0.188174
176,building a memorial to a son one child at a time,0.061388,0.046753,0.140691,0.309765,0.253159,0.188243
177,northeaster cancels flights shuts schools,0.061184,0.047277,0.139314,0.311638,0.252316,0.188272
178,india to test new nuclear missile,0.061744,0.04783,0.139831,0.307089,0.254688,0.188818
179,dell to cut bonuses trim management,0.061523,0.046917,0.139925,0.309572,0.253362,0.188701
180,uk workers on alert for letter bombs,0.061671,0.047686,0.139989,0.308657,0.253242,0.188755
181,storm leaves behind major travel troubles,0.061471,0.04759,0.139522,0.310721,0.252562,0.188134
182,rupert murdoch s secret tivo,0.061603,0.047236,0.140429,0.311483,0.251022,0.188227
183,house passes anti terrorism measure manila,0.061263,0.047351,0.139414,0.310973,0.252649,0.18835
184,genghis khan beer mongolia grimaces,0.061184,0.047277,0.139314,0.311638,0.252316,0.188272
185,youtube founders split m payout,0.062386,0.048113,0.141507,0.308748,0.252063,0.187183
186,former teacher poses for playboy,0.061557,0.046939,0.140547,0.307973,0.253663,0.189322
187,madonna files adoption papers in malawi,0.059355,0.045886,0.13477,0.329939,0.2436,0.186451
188,eye on cosmos is lost to short circuit on hubble,0.06125,0.047052,0.139886,0.309407,0.253276,0.18913
189,all african amputee football games kick off,0.062002,0.047614,0.140905,0.309012,0.252999,0.187469
190,forecasters expect toasty,0.060945,0.047056,0.139007,0.313642,0.251312,0.188039
191,corn stoves popping up in u s homes,0.061956,0.047912,0.140141,0.309588,0.252497,0.187906
192,chvez threatens to jail violators of price controls,0.061979,0.047756,0.140072,0.306189,0.255183,0.18882
193,scientists discover miracle in the depths,0.061952,0.047893,0.140666,0.306218,0.254258,0.189012
194,google unveils do it yourself search engine,0.061956,0.047912,0.140141,0.309588,0.252497,0.187906
195,ready to eat chicken breasts recalled due to suspected listeria,0.061798,0.047817,0.140305,0.307965,0.253761,0.188354
196,teen allegedly armed by mom turns self in,0.062067,0.048001,0.140857,0.30557,0.25498,0.188524
197,town packs gym to mourn killed in fire,0.061684,0.047395,0.13997,0.308345,0.25385,0.188757
198,cocoa could be antidote to age related diseases says new study,0.061921,0.047906,0.140458,0.306584,0.254612,0.188519
199,roundup protests erupt despite state of siege in guinea,0.062052,0.047997,0.140797,0.305578,0.255011,0.188564
200,bush authorized iranians arrest in iraq rice says,0.061327,0.047411,0.139493,0.310441,0.252917,0.188412
201,anglican and catholic churches could merge,0.062219,0.047782,0.14035,0.309225,0.252667,0.187758
202,cousin gunman was srebrenica survivor,0.0605,0.044604,0.13629,0.33849,0.237656,0.182461
203,australia tells bush to speed up guantanamo trial,0.061789,0.047311,0.141106,0.30611,0.254828,0.188857
204,european space agency,0.060945,0.047056,0.139007,0.313642,0.251312,0.188039
205,the secrets people reveal,0.061881,0.047329,0.140791,0.309604,0.25363,0.186766
206,news baby pandas baby pandas baby pandas,0.06196,0.047892,0.140413,0.30849,0.25293,0.188316
207,health canada issues advice on canned tuna,0.061823,0.047299,0.140089,0.30936,0.253172,0.188258
208,grammys ready to name winners,0.061324,0.046673,0.139534,0.311088,0.252483,0.188898
209,asean urges north korea resolution,0.061537,0.047091,0.140585,0.310977,0.250776,0.189034
210,rebels to join nepal parliament,0.061399,0.04709,0.140125,0.309006,0.253465,0.188914
211,rice u s won t pull plug on iraq,0.061953,0.047917,0.140149,0.30923,0.252751,0.188
212,anglicans rebuke u s branch on same sex unions,0.061953,0.047917,0.140149,0.30923,0.252751,0.188
213,somalia declares state of emergency,0.061735,0.047664,0.14082,0.310735,0.251901,0.187145
214,hussein co defendants executed,0.061081,0.047182,0.139183,0.312495,0.251886,0.188172
215,james brown s year old son left out of will,0.061498,0.047154,0.140248,0.307705,0.254402,0.188994
216,ms adds office to vista coupon program,0.061443,0.046931,0.139694,0.309918,0.253082,0.188933
217,britain to limit workers from romania bulgaria,0.061456,0.047084,0.14014,0.30753,0.254589,0.189201
218,us airways boosts bid for delta,nan,nan,nan,nan,nan,nan
219,hpv vaccination stirs heated debate in america,0.062085,0.048007,0.140929,0.30556,0.254943,0.188476
220,full recovery expected for marathon winner,0.061459,0.047512,0.139546,0.310703,0.252234,0.188547
221,beckham won t play again for real,0.061671,0.047686,0.139989,0.308657,0.253242,0.188755
222,cultural revolutionary the ipod is five,0.061801,0.047635,0.141228,0.309697,0.252957,0.186682
223,village buried by inches of snow,0.06223,0.047386,0.141308,0.308081,0.253233,0.187763
224,mountain glaciers melting faster united nations says,0.062164,0.047986,0.140948,0.308791,0.252939,0.187172
225,ice storm smacks roads power,0.061881,0.047467,0.139514,0.312472,0.25173,0.186937
226,ex border patrol agent beaten in prison,0.062085,0.048007,0.140929,0.30556,0.254943,0.188476
227,israel to install cameras to show live mughrabi footage,0.06179,0.047806,0.140315,0.30815,0.253635,0.188304
228,latest updates on world s top stories,0.056465,0.043186,0.129051,0.354219,0.232853,0.184226
229,lily allen wins web music award,0.062083,0.047678,0.140043,0.309914,0.252934,0.187348
230,rowling heartbroken euphoric at potter s end,0.061634,0.046946,0.140177,0.31132,0.251186,0.188737
231,hamas fatah leaders pledge to meet until they reach agreement,0.06155,0.047167,0.139826,0.308884,0.253617,0.188955
232,new vaccine for cervical cancer could prove useful in men too,0.061691,0.047734,0.140061,0.308944,0.253321,0.188249
233,mbeki world cup planning on track,0.061979,0.047265,0.140724,0.307609,0.253627,0.188796
234,money makeovers,0.060753,0.046878,0.138754,0.315259,0.250506,0.187851
235,punter charged with stabbing asks to live outside state,0.061629,0.0473,0.140072,0.307025,0.255053,0.188921
236,emi warns on profits boss goes,0.061621,0.047593,0.140454,0.309544,0.253521,0.187267
237,gunman fine before shooting,0.062458,0.048137,0.141712,0.309152,0.251615,0.186926
238,svindal claims are golden double,0.061417,0.047544,0.139435,0.311355,0.252219,0.18803
239,ethiopia readies for millennium all its own,0.061808,0.047793,0.140301,0.307116,0.253806,0.189176
240,mancuso sparks u s celebrations,0.06064,0.046304,0.139533,0.311743,0.253176,0.188605
241,nasa spacecraft to measure sun,0.061399,0.04709,0.140125,0.309006,0.253465,0.188914
242,teen repellent inventor wins infamous prize,0.062025,0.047634,0.139913,0.310977,0.251881,0.187571
243,peron held over s rights abuses,0.061676,0.047539,0.140942,0.309725,0.252446,0.187673
244,kim jong il bans japanese cars in north korea,0.061589,0.04736,0.139736,0.30936,0.253519,0.188435
245,canadians tracked in child porn ring,0.061952,0.047893,0.140666,0.306218,0.254258,0.189012
246,ryan o neal injured son s girlfriend,0.062022,0.047876,0.140626,0.309396,0.252361,0.18772
247,messi makes barcelona squad return,0.061555,0.047596,0.13996,0.310999,0.252081,0.187809
248,brith airways baggage charges cause confusion,0.061263,0.047351,0.139414,0.310973,0.252649,0.18835
249,a film star in kampala conjuring aminos ghost,0.062067,0.048001,0.140857,0.30557,0.25498,0.188524
250,opponent is put on the spot over remarks about clinton,0.061791,0.047394,0.140647,0.306327,0.254784,0.189057
251,apple set for massive market gains,0.061335,0.047394,0.139659,0.309933,0.25294,0.188738
252,vista s hyped security will be tested,0.061292,0.047013,0.139996,0.310827,0.251828,0.189044
253,dating difficult for harry potter,0.061557,0.046939,0.140547,0.307973,0.253663,0.189322
254,uk letter bombs may be from extremist drivers,0.061963,0.047389,0.140635,0.307257,0.253925,0.188831
255,bush vows cooperation on health care,0.062112,0.047679,0.141486,0.307291,0.253445,0.187987
256,baby born on turnpike after dad misses exit,0.061756,0.047487,0.140461,0.30789,0.253547,0.18886
257,parachutist dies at bridge jump festival,0.062026,0.047416,0.141996,0.308426,0.251591,0.188544
258,citing spy agencies study democrats seek iraq changes,0.061652,0.047694,0.140034,0.309541,0.252959,0.18812
259,airlines uk airport runway unsafe,0.062258,0.047757,0.140366,0.309659,0.25235,0.187611
260,man gets second chance at space ride,0.061714,0.047392,0.140248,0.309967,0.253438,0.187242
261,archaeologists find remains of couple locked in a hug,0.061695,0.04772,0.139986,0.308047,0.253542,0.189011
262,study detects a gene linked to alzheimer s,0.061693,0.047712,0.140008,0.308368,0.253443,0.188776
263,weight loss drug to be sold over the counter,0.061695,0.04772,0.139986,0.308047,0.253542,0.189011
264,zach braff says he has mild depression,0.062187,0.047802,0.140336,0.308876,0.252923,0.187876
265,apple warns itunes users to wait on vista,0.061083,0.046951,0.138293,0.315367,0.250409,0.187897
266,guy sweat is babe magnet,0.061555,0.047596,0.13996,0.310999,0.252081,0.187809
267,in egypt rice speaks softly,0.062136,0.048022,0.141133,0.305533,0.254836,0.18834
268,ex jonbenet suspect child porn case dropped,0.062187,0.047802,0.140336,0.308876,0.252923,0.187876
