textid,Words,anger,disgust,fear,joy,sad,surprise
269,court tv accused killer tells jury a love story,0.061882,0.047593,0.14056,0.307991,0.254319,0.187656
270,us to urge nato afghan spring offensive,0.061761,0.047843,0.139869,0.306935,0.254757,0.188835
271,texan allegedly joined somalia rebel plot,0.061471,0.04759,0.139522,0.310721,0.252562,0.188134
272,tensions as hungary marks uprising,0.061184,0.047277,0.139314,0.311638,0.252316,0.188272
273,idf shells lebanese army positions across northern border,0.061953,0.047917,0.140149,0.30923,0.252751,0.188
274,north korea claims nuclear test,0.061537,0.047091,0.140585,0.310977,0.250776,0.189034
275,beckham to l a for the game not fame,0.062049,0.047731,0.140071,0.30916,0.253354,0.187634
276,hungary police tackle violent protestors,0.061417,0.047544,0.139435,0.311355,0.252219,0.18803
277,arthurs upsets robredo in first round at the st petersburg open,0.06173,0.047525,0.140021,0.307729,0.254185,0.18881
278,brazil air force cites faults and confusion in fatal crash,0.061831,0.047831,0.140273,0.306762,0.254177,0.189126
279,war is close ethiopia tells somali rebels,0.061626,0.047668,0.140015,0.309929,0.252725,0.188037
280,democrats plot bush troop increase censure,0.061263,0.047351,0.139414,0.310973,0.252649,0.18835
281,bangladesh ferry sinks dead,0.061964,0.047887,0.140093,0.311284,0.251307,0.187465
282,sale of chrysler possible,0.061964,0.047887,0.140093,0.311284,0.251307,0.187465
283,lawyer for deceased nazi era collaborator papon vows to bury him,0.06174,0.047765,0.140048,0.30776,0.253867,0.18882
284,mixed reaction to china s africa push,0.06156,0.047581,0.140089,0.307972,0.253873,0.188926
285,jon stewart mocks benefits of cnn s i,0.061926,0.047541,0.14114,0.307173,0.253203,0.189018
286,top colombia official resigns,0.061695,0.047321,0.139617,0.311093,0.252419,0.187854
287,toshiba portege r,0.060945,0.047056,0.139007,0.313642,0.251312,0.188039
288,luxury digs in south carolina s lowcountry,0.06156,0.047581,0.140089,0.307972,0.253873,0.188926
289,th person dies after receiving flu shot,0.061813,0.047668,0.141132,0.309261,0.253213,0.186912
290,bears watch as lead slips away,0.061676,0.047539,0.140942,0.309725,0.252446,0.187673
291,jail me i ate ivory coast chocolate,0.061515,0.047626,0.139591,0.310215,0.252837,0.188216
292,teacher charged with sex assault,0.061962,0.047898,0.140115,0.310575,0.251802,0.187648
293,college tuition continues climbing,0.061081,0.047182,0.139183,0.312495,0.251886,0.188172
294,matthews lays off turkey workers,0.061417,0.047544,0.139435,0.311355,0.252219,0.18803
295,space life search turns to tv,0.06128,0.046979,0.13985,0.308828,0.253791,0.189273
296,myspace welcomes french friends,0.061081,0.047182,0.139183,0.312495,0.251886,0.188172
297,hackers attack root servers,0.061695,0.047321,0.139617,0.311093,0.252419,0.187854
298,ice storm coating midwest,0.061792,0.047754,0.139704,0.312153,0.25165,0.186946
299,gop senators to force debate on troops in iraq,0.061441,0.047246,0.139398,0.310721,0.252907,0.188288
300,ex teacher guilty in nude pictures scheme,0.062085,0.048007,0.140929,0.30556,0.254943,0.188476
301,years on but couple still hugging,0.061712,0.047062,0.140355,0.307842,0.254141,0.188888
302,pats fourth quarter rally finishes chargers,0.061969,0.047827,0.141215,0.308799,0.252665,0.187525
303,review alpha dog misses the point,0.057158,0.043797,0.130455,0.350732,0.233247,0.184611
304,andromeda involved in galactic collision,0.062136,0.048022,0.141133,0.305533,0.254836,0.18834
305,injured marathon winner leaves hospital,0.060815,0.046711,0.137648,0.318637,0.249075,0.187114
306,kate is marrying doherty,0.061081,0.047182,0.139183,0.312495,0.251886,0.188172
307,baghdad plan is a success iraq prime minister tells bush,0.061838,0.047538,0.140973,0.306656,0.254326,0.188669
308,beckham outlines reasons for move,0.061412,0.046828,0.140663,0.308237,0.253183,0.189677
309,al qaeda chiefs are seen to regain power,0.061498,0.046864,0.140238,0.308626,0.254424,0.18835
310,start late retire rich,0.061346,0.047486,0.139321,0.312171,0.251778,0.187898
311,autos drive european gains,0.061081,0.047182,0.139183,0.312495,0.251886,0.188172
312,immigrants and french reach deal in standoff,0.062085,0.048007,0.140929,0.30556,0.254943,0.188476
